id,author,author_details,content,created_at,iso_639_1,media_id,media_title,media_type,updated_at,url
5c15a5c8c3a36866cc370c2c,LadyGreenEyes,"{'name': '', 'username': 'LadyGreenEyes', 'avatar_path': None, 'rating': 1.0}","This one killed the franchise!  I have been watching Star Wars movies since they started literally, going to the theater and enjoying the fun.  Love the original three.  Liked the prequels well enough.  I even enjoyed the cute little Ewok movies, with the kids.  

These later films have been a mixed bag.  Most were watchable enough, though not really the caliber of the old films  Sure, the effects are great, but a good movie needs more than special effects and cool alien makeup and some fun droids.

This movie was seriously disappointing.  Everything about familiar characters was changed, and the plot was so busy with pushing some weird agenda that it failed to deliver any of what we go to a Star Wars movie to see.  At this stage, I couldn't care less about the newer characters, and the whole ""Mary Sue"" aspect to the one main girl (see, I can't even recall her name!) is just annoying.  This film w bad enough that the dedicated SW fanboy in my household just quit watching, and actualy, for the first time ever, skipped the following movie entirely.  

So, congrats, Disney; you killed one of the most successful franchises ever.",2018-12-16T01:09:28.138Z,en,181808,Star Wars: The Last Jedi,movie,2021-06-23T15:58:15.120Z,https://www.themoviedb.org/review/5c15a5c8c3a36866cc370c2c
5df9384c65686e00158a23de,Manuel São Bento,"{'name': 'Manuel São Bento', 'username': 'msbreviews', 'avatar_path': None, 'rating': 8.0}","If you enjoy reading my Spoiler-Free reviews, please follow my blog @
https://www.msbreviews.com

Finally, I managed to watch one of my most anticipated movies of 2017! I am an authentic fanboy of the Star Wars saga and I loved its return two years ago when The Force Awakens was released. Everything looked better, sounded better and the story certainly didn't disappoint me. So, obviously, I was extremely looking forward to The Last Jedi.

Apparently, critics love Episode VIII but fans not so much. Me, well ... I don't LOVE it, but I do enjoy it very much. I do think it is a bit below the previous film's overall quality since it definitely has some issues the first one did not. I am also confident that I know why the fans are not loving this movie and I will explain that after a few paragraphs.

This time, I am going to start at the other side of the spectrum. I will begin my review with the film's problems because I do need to get them out of my mind, especially this one ... The subplot involving Finn (John Boyega), Rose (Kelly Marie Tran) and DJ (Benicio Del Toro), some of the few new characters added to the franchise, completely ruins the movie's pacing and its narrative is such a tremendous deviation from the main story. It is, by far, the worst issue I have with the screenplay because it does not work as one single problem ... It creates a whole other set of them.

The first act's pacing is really fast since it starts with tons of action sequences. However, the second act decreases the rhythm and it is more story-driven, full of mystery-unlocking and character-development scenes. Finn and Rose's nonsense adventure just turns everything slower and even strange. It ends up needlessly extending the runtime (the film could have easily been 15min shorter) and worse ... Possibly creating a love triangle with Rey (I am not even going to discuss this).

Apart from this major issue(s), I have some minor problems. General Hux (Domhnall Gleeson) is a strong candidate to become the most annoying character in this new-generation trilogy. Gleeson is fine, he actually achieves a good over-the-top performance, but his character is just tumbling off the rails. Also, on a more technical aspect, the writing does not flow as well as it did on J.J. Abrams' screenplay. There are a lot more exposition scenes which also does not help the pacing at all.

I wrote earlier about the fans' reasons for them to be disappointed and well, the marketing for the movie did not lie: they do take a lot of chances with this one. Rian Johnson delivers a lot of twists and shocks throughout the whole runtime and it is impossible to assume that every single one of them is going to be mind-blowing and unanimously accepted. I do not want to give anything away from the plot, so I am just going to write that most of the choices and paths they choose for each character, I either simply accept them or I truly love them. As for the rest, I am, at most, underwhelmed (yet, I trust and understand the decisions they went with).

People need to learn how to deal with their own expectations. If you expect something utterly absurd and nonsensical to occur and then it does not, you can't blame the film for not following your crazy idea. So, please, don't start blabbing any movie is bad or disappointing because it didn't fulfill your ridiculously high expectations. Even if they are grounded and thoughtful, you have to embrace the production's approach to the character/story. If it makes sense, then it is as valid as any other theory. It might be underwhelming if you have high expectations, but it is still a serious take on whatever you are thinking.

This is why I think fans are not loving The Last Jedi. The production takes a lot of risks and some of them don't work with everyone, mostly due to fans' radical theories that don't have a place in the film. I think most people might change their initial opinion after a second viewing, myself included. Some things just need more time to process or even a whole rewatch. Since I do not have time to do it before the year's end, I am going with what I have.

Switching to the light side (hehe), I do enjoy this movie a lot. Every cast member that was great in Episode VII, transcends themselves in this one. Daisy Ridley is superb as Rey. She has such a massive range of expressions and I am sure her successful future as an actress is surely guaranteed. From the most emotional and somber moments to the most epic action scenes, she is awesome. Her character's mysterious backstory reaches a whole new extent and her interactions with Kylo Ren (Adam Driver) and Luke Skywalker inflict chills all over my body.

Mark Hamill's comeback can't be any more amazing than it is. He delivers a fantastic, emotion-full and very compelling performance. It is even more unbelievable knowing that Hamill had strong personal arguments against the director's interpretation of what was better for Luke. If he is this astounding working against his own idea of who his character really is, then I must praise his exemplary working principles.

Luke and Rey spend a big chunk of the runtime training on an unknown island and I love every single second filmed on that piece of land. I have to admit that I am a bit frustrated because I think the film should have more time with these two, but due to the issues mentioned in the beginning of my review, the runtime can't be much more stretched. I love what they did with Luke, even if some fans are going to go insane with his journey.

Adam Driver as Kylo Ren ... The undoubtful star of the whole show. Driver is becoming a menace to every actor working today because he is flawless. He has a powerful, dark, mysterious, compelling and commanding display as one of the most complex and multi-layered characters of the Star Wars saga. Ren's conflict inside his mind and heart is the most captivating feature of his story and his interactions with Rey are so jaw-dropping spectacular that I can't even describe them properly.

John Boyega is once again great as Finn, even though he is part of that horrible subplot. Boyega delivers a convincing performance and Finn shines through some awesome action set pieces. Kelly Marie Tran is actually good as Rose, it is just a pity that her character suffers from the narrative, even though her backstory is pretty touching. Chewbacca (Joonas Suotamo) and the Porgs, the new cute animals implemented in the Star Wars universe, have all the funny scenes plus some action here and there.

Oscar Isaac is quite lucky because Poe Dameron unquestionably has the best subplot of the movie. Isaac offers a very passionate display as Poe goes through some significant character development. His impulsive instincts to attack the bad guys always have consequences and he is put in check by Leia (Carrie Fisher) during the whole time. It is a very interesting and twistful story that elevates the film's main plot.

Carrie Fisher is elegant and beautiful as Leia, a character that has a lot more screentime than what I expected. I always love seeing Fisher on the screen and she makes everything a bit more realistic to me. Andy Serkis is remarkable as Supreme Leader Snoke, but his character is yet another plot's detail that fans are not going to appreciate so much. I still feel underwhelmed by Snoke in this movie for several reasons, but after some thinking, I do understand his role in the film and his moments are indeed intimidating and dominant.

Rian Johnson work as the director is better than him as the writer. The visuals effects continue to be wonderful and the practical settings are beautiful, once again, there is a lot less CGI than you probably think. Excellent cinematography and the John Williams' score induces enormous levels of nostalgia and excitement. The action sequences are mind-blowing, the stunt work is phenomenal and there are tons of pure epic and awesome scenes.

The main plot includes a very dark and mysterious side to it that I thoroughly love. A lot of unexpected twists and turns make The Last Jedi more original than The Force Awakens, even if one or two plot points might be underwhelming, and it also has a very well balanced tone. Finally, a thrilling, breathtaking, action-heavy third act ends the film with magnificent glory and with many heartfelt moments.

All in all, Star Wars: The Last Jedi delivers something that I can be proud of experiencing. Terrific performances from the cast, but a flawlessly powerful display from Adam Driver as Kylo Ren steals the spotlight. Rian Johnson takes a lot of risks with decisions that will make the fanbase debate for years and while I find most of them truly jaw-dropping, a few left me underwhelmed. The main story keeps its obscure mystery while packing some jaw-dropping, epic action sequences and excellent character-development scenes. Nevertheless, it departs from JJ’s visual storytelling, delivering a more exposition-heavy screenplay and some pacing issues bring the movie down, largely due to the unnecessary detour of the subplot involving Finn and Rose. In the end, it still belongs to my top half of the saga, fighting for the 4th spot with Return Of The Jedi and Rogue One.

Rating: B+",2019-12-17T20:19:24.851Z,en,181808,Star Wars: The Last Jedi,movie,2021-06-23T15:58:30.040Z,https://www.themoviedb.org/review/5df9384c65686e00158a23de
601ca3a91108a8003fc4d46f,r96sk,"{'name': '', 'username': 'r96sk', 'avatar_path': '/mwR7rFHoDcobAx1i61I3skzMW3U.jpg', 'rating': 9.0}","Excellent, one of my favourites from the franchise so far.

<em>'Star Wars: The Last Jedi'</em> makes for an exciting 152 minutes! Sure it probably could've been a little shorter, but at no point did I personally feel it drag. The cast give great performances, while the music and whole look of the film is extremely pleasant.

Daisy Ridley and John Boyega do their thing and are enjoyable once again, Ridley particularly impressed me. I also like Adam Driver in this, while it's always pleasing to see Mark Hamill and Carrie Fisher involved. As for newcomers, Benicio del Toro and Kelly Marie Tran stand out.

There are also some incredible shots, the entire sequence at the end thrilled me - there's a particular part involving Laura Dern (even if her character, overall, isn't all that good) that looks utterly superb.

All in all, I felt very satisfied and very entertained after watching this. Quality film, in my eyes anyway.",2021-02-05T01:47:21.918Z,en,181808,Star Wars: The Last Jedi,movie,2021-06-23T15:58:51.232Z,https://www.themoviedb.org/review/601ca3a91108a8003fc4d46f
60bae3c58d2f8d0079606d31,Kurtzmansucks,"{'name': '', 'username': 'Kurtzmansucks', 'avatar_path': None, 'rating': 1.0}",Can't get much worse than this apparently the clown that directed this directed a good episode of Breaking Bad something tells me there was a lot of editing after they kicked this clown off the site because if this is his style he is plainly clueless about Star Wars mainly but also on how to tell a coherent story. The only good thing about this garbage was the visuals but that's it don't bother you will just get pissed off watching this mess in the end like the rest of the theater we were in have never seen so many people booing in a theater.,2021-06-05T02:39:01.753Z,en,181808,Star Wars: The Last Jedi,movie,2021-06-23T17:16:48.865Z,https://www.themoviedb.org/review/60bae3c58d2f8d0079606d31
63c20b9117b5ef00a7fbad33,GenerationofSwine,"{'name': '', 'username': 'GenerationofSwine', 'avatar_path': '/xYhvrFNntgAowjRsf6mRg9JgITr.jpg', 'rating': 1.0}","Some of the praise, at least from the fans is because of the deviation from Star Wars tradition which, honestly, I have an issue with out the door. We are watching it because we want to see a Star Wars film.

And the deviation from Star Wars tradition seems especially ridiculous given how hard it tries--like The Force Awakens--to rely on nostalgia to keep the fans that felt alienated when Rey turned out to be, well, absolutely flawless, absolutely loved and trusted by absolutely everyone, and faced no real challenges or struggles...

...so, bank on nostalgia because giving the primary character a real literary struggle to add to a sense of character and plot is still seemingly out of the question.

And that kind of seems like a troupe now days of characters that are diverse for the state of diversity. It seems like their creator and political fans feel that adding any struggle for said character to overcome would somehow take away from the political importance of the character.

And that holds true for The Last Jedi. Rey still has no real struggles that can create even the slightest bit of dramatic tension for the audience. It is understood that she is the best and can easily overcome anything the story throws at her...and she does.

And that is the reason her character is rejected by fans. It doesn't make for good cinema. Skywalker had the same issues in I-III, but at least it was understood that he was going to fail at the end of his story arc only to be redeemed in Luke's.

Rey is still so perfect there is no dramatic tension where she is involved.

But, don't let that be the only thing that kills it for you. Poe's initial radio play with the new faux Empire sets the entire movie up for one long eye roll. Those jokes seemed so out of place for science-fiction that it killed the movie from the start.

But then the bad humor of your lame aunt that only think's she's funny is also a new troupe for movies for movies like this.

So the films have to rely on nostalgia to market it to fans of the last two trilogies...and in this case it doesn't really work. The nostalgia is more along the lines of ""Remember when Luke Skywalker was a thing"" variety. The sort of nostalgia that references the old beloved franchise, without really understanding the dynamic of it.

They did the same ""Remember when this happened"" nostalgic ploy in The Force Awakens and, like then they didn't have the background and understanding to pull it off. Solo wasn't really the cynical untrusting scoundrel that made him so beloved. And in this one Luke isn't the whiny flawed but blindly moral hero that gets in over his head.

The result is a nostalgia that is just an empty reference. A nostalgia that has no real idea what it is referencing, or at least not one that runs any deeper than the surface.

So the jokes don't land. So hero doesn't struggle and... ...the film has no real drama because of the lack of struggle. So the nostalgia is only skin deep and... ...it results in a nostalgia that is more of an insult to the older fan base that it tries to appeal to.

Disney didn't listen to the fans that complained about The Force Awakens. They were too busy calling them names for not loving the film. All the fans wanted was a story, that is all, they wanted a struggle, they wanted real drama. They wanted the characters they loved to be the characters they loved.

What they got instead was a character easily walks into every situation and beats every adversity with ease still...despite that being the main complaint.

What they got was old heroes acting like different people again.

What they got was another bad movie.",2023-01-14T01:55:29.174Z,en,181808,Star Wars: The Last Jedi,movie,2023-01-14T01:55:29.255Z,https://www.themoviedb.org/review/63c20b9117b5ef00a7fbad33
665e0266e7907a34c3bc924e,CinemaSerf,"{'name': 'CinemaSerf', 'username': 'Geronimo1967', 'avatar_path': '/yz2HPme8NPLne0mM8tBnZ5ZWJzf.jpg', 'rating': 6.0}","How very, very disappointing this was. The not in the least menacing ""Kylo Ren"" (Adam Driver) has got the rag-tag rebel fleet under the command of his mum ""Princess/General Leia"" (Carrie Fisher) firmly in his sights, and only ""Luke"" (Mark Hamill) who is training ""Rey"" (Daisy Ridley) to become a Jedi too, can hope to thwart their ultimate destruction as the First Order's intergalactic pursuit gradually whittles down the remains of their fleet. Meantime, ""Finn"" (John Boyega) with the scene stealing BB-8 embark on an highly dangerous mission to nobble the tracking device that is putting them all in such peril. The original ""Star Wars"" (1977) is probably my favourite film ever, and this is not even a distant cousin. Sure there are a few vestiges of the first film - the attack on the Dreadnought is quite exciting, but the rest of this is a poorly written and conceived version that throws the characterisations under the bus that is CGI. Great effects, loads of laser shoot 'em ups, but where has the charisma gone? There is no jeopardy - the storyline plods along with bumps in the road, but with little doubt as to the final outcome. For me (a baddie-lover) that means the thing lacks anything of interest. I enjoyed it ok - I saw it as part of a triple bill before the final instalment was released, but the more I watched the less I remembered. What a pity.",2024-06-03T17:50:30.656Z,en,181808,Star Wars: The Last Jedi,movie,2024-06-03T17:50:30.764Z,https://www.themoviedb.org/review/665e0266e7907a34c3bc924e
667933b7d0fe030963ee7bfc,Dreadful_Utopia,"{'name': '', 'username': 'Dreadful_Utopia', 'avatar_path': None, 'rating': 10.0}","The Last Jedi is a masterpiece that most fans at the time of its release couldn't recognise.

The Last Jedi was a shining gem in an otherwise flawed trilogy of movies. It dared to be different, added complexity to characters, humanising them, and taught a valuable lesson that we are not defined by our mistakes, that they simply exist as a lesson for us to grow from.

With some of the most iconic scenes within Star Wars, such as the Throne Room fight or Luke's standoff, this movie felt like a true sequel to the original trilogy.

It's a shame that people were so critical of this movie, mostly due to its portrayal of Luke, that caused such a negative reception to the movie. Because at the heart of this movie is a beautiful story with beautiful visuals and amazing action sequences to accompany it.",2024-06-24T08:52:07.972Z,en,181808,Star Wars: The Last Jedi,movie,2024-06-24T14:31:21.373Z,https://www.themoviedb.org/review/667933b7d0fe030963ee7bfc
5dd831ab3faba00015f96deb,deRedtube,"{'name': '', 'username': 'deRedtube', 'avatar_path': '/6nIEInjIEgz1V2Chuo8WtrKClZd.jpg', 'rating': 7.0}","The kingdom of Arendelle needs to be evacuated when the forces of nature threaten to destroy it. Elsa, Anna, Olaf and Kristoff set off to find some answers. But Elsa has been distracted. She has been hearing an unfamiliar voice calling out to her in a strange tune. Led by her, the group follows the melody to find themselves at the edge of an Enchanted Forest with untold mysteries and dangers.

Rather than retracing the steps of its record-breaking predecessor, ‘Frozen 2’ tries some new thematic tricks. This time around, the surprisingly mature plot focuses on transformation and growing up. The film’s setup leading up to the climax appears to be promising, but its third act doesn’t quite live up to expectations. The conflict resolution lacks a sense of impact and feels rushed. This is particularly baffling since the first half tends to meander, focusing on songs than on purposefully furthering the plot. Additionally, the tracks are far too many and certainly not as catchy as the first film. Which isn’t to say they are bad – the compositions are layered, but it is yet to be seen if they have enough sing-along power to become as popular as ‘Let It Go’. Still, the picturizations of the music is incredibly captivating.

This extends to the rest of the film’s animation too, and some vibrant colors combine with photo-realistic visuals to create quite a spectacle. Minor details are noticeable as they enhance the essence of each character. While each of the group gets their moments, Elsa and Anna continue to be the focal points. The uncontainable chemistry of Idina Menzel and Kristen Bell, respectively, picks up where they left off without missing a beat. Olaf provides ample humor, either in visual slapstick or by Josh Gad’s endearing yet tongue-in-cheek, almost self-aware delivery. An interesting new character played by Sterling K. Brown is an immediate standout. However, a subplot involving Kristoff and Anna feels shoed in to give Jonathan Groff something to do besides singing probably the most amusing song in the soundtrack.

It’s a tall order to expect this sequel to capture the lightning-in-a-bottle magic of the original, but Frozen 2’s stunning eye-candy and humor will be enjoyable enough for its younger core audience.",2019-11-22T19:06:19.410Z,en,330457,Frozen II,movie,2021-06-23T15:58:29.268Z,https://www.themoviedb.org/review/5dd831ab3faba00015f96deb
5ddb52473faba00013ff93b2,SWITCH.,"{'name': 'SWITCH.', 'username': 'maketheSWITCH', 'avatar_path': '/klZ9hebmc8biG1RC4WmzNFnciJN.jpg', 'rating': 6.0}","While ‘Frozen 2’ isn’t as strong a film as I had hoped it would be, I wouldn’t go so far as to call it a disappointment. It’s still incredibly entertaining and I found myself engaged throughout. These films do have an undeniable charm, and outside of the now-completed ‘How to Train Your Dragon’ trilogy, ‘Moana’ and Laika’s ‘Missing Link’, these are the only major American animated films attempting the use the form to create a cinematic experience. It is a pity that the story never finds its feet; a combination of this level of craft and a real ripper of a yarn would have made this a slam-dunk. As it stands though, the magic of the ‘Frozen’ franchise is still there - dimmed, but there nonetheless.
- Daniel Lammin

Read Daniel's full article...
https://www.maketheswitch.com.au/article/review-frozen-2-elsa-and-anna-return-with-the-magic-mostly-intact",2019-11-25T04:02:15.441Z,en,330457,Frozen II,movie,2021-06-23T15:58:29.338Z,https://www.themoviedb.org/review/5ddb52473faba00013ff93b2
