id,author,author_details,content,created_at,iso_639_1,media_id,media_title,media_type,updated_at,url
5b1678d7c3a3685352018aad,Gimly,"{'name': 'Gimly', 'username': 'Ruuz', 'avatar_path': '/xUObnJSvHrFPsIpoDmb1jiQZLq7.jpg', 'rating': 7.0}","**A long form review originally posted in 2015:**

I’ve just returned from two back-to-back viewings of _Avengers: Age of Ultron_, and I do not regret one bit going in for that second helping.

I lost my steam on the _Age of Ultron_ wagon at a very inopportune moment. About three days before it came out. I was so heavily anticipating it for such a long time, that I was actually much more excited to see this movie when it was still two months away than I was waiting in line to get into the cinema it was playing at. The combination of the market-saturation and the fact that the _Ultron _hype-train has been running for literally years, with a first trailer dropping seven months before the damn thing came out, meant I got weary of the thing just a fraction too soon. But I’m a sucker for the MCU, and there was no way I was missing the sequel to my favourite superhero movie of all time.

I won’t harp on too much, because I don’t want to spoil anything (especially given that the movie isn’t even out in most parts of the world), I will put out a spoilertalk on this blog at some point down the line, but for now just let me leave you with a couple of quick thoughts.

_Age of Ultron_ is not the best film of all time. It’s not the best superhero film of all time, it’s not even the best MCU film. Honestly, I personally feel it’s not even the best MCU Phase 2 film. But it is still good. And that’s what’s important here. But what do I mean by that? 

Well, for starters, in and of itself, I loved it, a breach past an 80% approval rating from me is no small thing. The things we enjoyed from the first _Avengers_are here. The mesmerising action spectacles of course, but I more mean the character moments we got between the Avengers themselves, that was my favourite part of the first film and we get it here again in spades. 

Every new thing Joss has added to the plate works splendidly as well, real Hawkeye story, new heroes, a new villain, an updated world, all of these things are big ticks in lots of boxes.

So if everything from _The Avengers_ works and everything they’ve added works great too, why is _Age of Ultron_ not a perfect film? For spoiler-free purposes I will not go into detail, but that’s okay because the answer is quite simple: Everything in _Age of Ultron_ is great. It’s what’s not in _Age of Ultron_ that’s the problem.

Joss Whedon said that the film had to be cut by nearly an hour. That way you get more showings in, and that means more money. Now I’m not saying we need every minute of that hour back, but what we ended up being left with, was just enough for _Age of Ultron_ to be the _Thor: The Dark World_ of the _Avengers _franchise (it was a far superior film to _Dark World_, but hear me out). _Age of Ultron_ is little more than a holding pattern. The set-ups for future films take up too much time for the story to bear the weight of some actual story, but everything that occurs in the film itself somehow also has virtually no consequence on world it is a part of. I can’t say it more plainly than that: It’s a holding pattern. It introduces some stuff, but it doesn’t stand alone the first film did. It’s not such a big deal when the solo-movies do that (like the aforementioned _Dark World_) because we have _The Avengers_ films for those to pay off in. But when an _Avengers_ entry is just more of the same, I can’t fully get behind it.

That all said, _Age of Ultron_ is of course a lot of fun. A huge amount of fun, I can’t state that enough. And there’s literally nothing more important something in the entertainment industry can be. These are just the things holding it back from taking it up to the next level (or if I’m being completely honest, even taking it to the level the first film was at).

75%

-_Gimly_",2018-06-05T11:49:43.675Z,en,99861,Avengers: Age of Ultron,movie,2021-06-23T15:58:09.355Z,https://www.themoviedb.org/review/5b1678d7c3a3685352018aad
5c842655c3a3684e95db3e38,tmdb44006625,"{'name': '', 'username': 'tmdb44006625', 'avatar_path': None, 'rating': 5.0}","The fact that Joss Whedon was able to salvage some sort of coherent film out of all he was forced to cram into a single movie is quite commendable. But the sad fact is that Avengers: Age of Ultron is really just a run of the mill ""bad guy wants to destroy the world for reasons"" actioner that we've seen done better many times before.

Don't get me wrong. The movie's fun. The dialogue is frequently clever and humourous. And I really appreciated the quiet bits of storytelling that Whedon was able to sneak in. It's just that at the end of the day, the villain is weak sauce, there's way too much set up for other movies, and if I'm criticizing Man of Steel for having excessive destruction, I can't give Avengers a pass since they needlessly blow up not one, not two, but three cities. Pretty sure many insurance agencies went bankrupt paying out all the victims.",2019-03-09T20:47:17.431Z,en,99861,Avengers: Age of Ultron,movie,2021-06-23T15:58:19.186Z,https://www.themoviedb.org/review/5c842655c3a3684e95db3e38
5dc32f5299259c00187a12c4,Justin Lopez,"{'name': 'Justin Lopez', 'username': 'ShawnSmith', 'avatar_path': '/5zwo9rNpYTQxPFxXJeYHxEw86SC.jpg', 'rating': None}","Movie was great but felt like there was just too much action and fighting. The creativity of the choreography gets lost in the whirlwind of action and this I noticed most in Captain America's scenes. He does like a hundred different awesome things with his shield, but you don't have time to really take it in because you're already looking at Iron Man blasting 20 Ultron-bots to bits.",2019-11-06T20:38:42.032Z,en,99861,Avengers: Age of Ultron,movie,2021-06-23T15:58:28.578Z,https://www.themoviedb.org/review/5dc32f5299259c00187a12c4
5dc389ff8d22fc00143d1db1,LoganWright,"{'name': 'LoganWright', 'username': 'LoganWright1', 'avatar_path': '/4o5phid5homM5vcwwEE3Mg6FS4H.jpg', 'rating': None}","This is the movie where Captain America became my favorite Avenger. Sure he doesn't have monstrous abilities like Iron Man and Hulk, but to be holding his own on the same ground as them is just a testament to how great of a hero he truly is.",2019-11-07T03:05:35.729Z,en,99861,Avengers: Age of Ultron,movie,2021-06-23T15:58:28.637Z,https://www.themoviedb.org/review/5dc389ff8d22fc00143d1db1
5dc393227d2bc100133d151b,BradleyStewart,"{'name': 'BradleyStewart', 'username': 'BradleyStewart', 'avatar_path': '/orXNhkMKAAHKVhIKS3DD8I6jnxd.jpg', 'rating': None}","It has become a well-known fact that coming out with a sequel that's better than, if not on par with, the first one is an insane task. But kudos to Marvel for staying true to their colors with this sequel.",2019-11-07T03:44:34.837Z,en,99861,Avengers: Age of Ultron,movie,2021-06-23T15:58:28.689Z,https://www.themoviedb.org/review/5dc393227d2bc100133d151b
5dc399569d89390013350f9f,Jane Hall,"{'name': 'Jane Hall', 'username': 'JaneHall', 'avatar_path': '/jJy4oZdlQp1BkqaEiWlCeBzPxDV.jpg', 'rating': None}",I expected more from Quicksilver.  He would've been a great addition to the Avengers.,2019-11-07T04:11:02.061Z,en,99861,Avengers: Age of Ultron,movie,2021-06-23T15:58:28.729Z,https://www.themoviedb.org/review/5dc399569d89390013350f9f
5dc56e74470ead00189063a7,JessieCollins,"{'name': 'JessieCollins', 'username': 'JessieCollins', 'avatar_path': '/gW1joveFfv736XrPgXOSpNgj8ju.jpg', 'rating': None}","The thing that puzzles me is that in this film, Vision is presented to be a powerful hero, having the mind stone and all. But on the next films, he's become more of like a side character that just wasn't relevant anymore except for that little piece of stone on his forehead. Shame.",2019-11-08T13:32:36.277Z,en,99861,Avengers: Age of Ultron,movie,2021-06-23T15:58:28.780Z,https://www.themoviedb.org/review/5dc56e74470ead00189063a7
5dc579e46f8d950017c29a57,John Smith,"{'name': 'John Smith', 'username': '1JohnSmith1', 'avatar_path': '/3pdg3XNVdCkOs17PrCXnDxpmNyp.jpg', 'rating': None}",I'm glad to see that they found another role for Hawkeye other than being that one guy who seemed to be trying hard to keep up with the other more powerful heroes on the team. Now he's more of like the thing that keeps the team together and it suits his character well.,2019-11-08T14:21:24.351Z,en,99861,Avengers: Age of Ultron,movie,2021-06-23T15:58:28.816Z,https://www.themoviedb.org/review/5dc579e46f8d950017c29a57
5e00e910d1a89300198cbe02,Justin Lopez,"{'name': 'Justin Lopez', 'username': 'ShawnSmith', 'avatar_path': '/5zwo9rNpYTQxPFxXJeYHxEw86SC.jpg', 'rating': None}","Movie was great but felt like there was just too much action and fighting. The creativity of the choreography gets lost in the whirlwind of action and this I noticed most in Captain America's scenes. He does like a hundred different awesome things with his shield, but you don't have time to really take it in because you're already looking at Iron Man blasting 20 Ultron-bots to bits.",2019-12-23T16:19:28.195Z,en,99861,Avengers: Age of Ultron,movie,2021-06-23T15:58:30.410Z,https://www.themoviedb.org/review/5e00e910d1a89300198cbe02
5e00ee6875110d0011d84af1,1RobertJohnson1,"{'name': '', 'username': '1RobertJohnson1', 'avatar_path': None, 'rating': None}","Avengers: Age of Ultron
I liked plenty of the stuff in it but it was pretty much the same as the first movie. Still a good watch though if you're not looking for anything serious.",2019-12-23T16:42:16.041Z,en,99861,Avengers: Age of Ultron,movie,2021-06-23T15:58:30.425Z,https://www.themoviedb.org/review/5e00ee6875110d0011d84af1
5e01023d0284200019af5170,MichaelWilliams,"{'name': '', 'username': 'MichaelWilliams', 'avatar_path': None, 'rating': None}",The humor in this movie was not as witty as the first one. It felt too childish and cheesy.,2019-12-23T18:06:53.750Z,en,99861,Avengers: Age of Ultron,movie,2021-06-23T15:58:30.468Z,https://www.themoviedb.org/review/5e01023d0284200019af5170
5e011ad70284200016af7e51,WilliamJones,"{'name': '', 'username': 'WilliamJones', 'avatar_path': None, 'rating': None}","Still good, clean Avengers fun though a bit messier. The first one was still better.",2019-12-23T19:51:51.123Z,en,99861,Avengers: Age of Ultron,movie,2021-06-23T15:58:30.508Z,https://www.themoviedb.org/review/5e011ad70284200016af7e51
5e02863c26dac10012674860,DavidBrown1,"{'name': '', 'username': 'DavidBrown1', 'avatar_path': None, 'rating': None}","With the vast array of heroes and their own personal character stories, you can expect how much of a challenge it is to bring together all these superheroes and have them work on a single mission on a single timeline. It's not easy, experts.",2019-12-24T21:42:20.693Z,en,99861,Avengers: Age of Ultron,movie,2021-06-23T15:58:30.591Z,https://www.themoviedb.org/review/5e02863c26dac10012674860
5e08fd574a2226001728f48c,JosephWilson,"{'name': '', 'username': 'JosephWilson', 'avatar_path': '/8S3UwmIBCOLKVjfx2sKJeSgrRaF.jpg', 'rating': None}",I confirmed in this movie that what's really making these films successful is the chemistry that the actors have. You can really see that everyone's doing their best.,2019-12-29T19:24:07.133Z,en,99861,Avengers: Age of Ultron,movie,2021-06-23T15:58:30.935Z,https://www.themoviedb.org/review/5e08fd574a2226001728f48c
5e091e34a1c59d0018ab0aea,richardmiller,"{'name': '', 'username': 'richardmiller', 'avatar_path': '/1K04FeI31vKVrrudHBHLbEYGxNX.jpg', 'rating': None}","Strong film from beginning to end. Has just enough humor, angst, and drama to make it a film worthy to be called a sequel.",2019-12-29T21:44:20.547Z,en,99861,Avengers: Age of Ultron,movie,2021-06-23T15:58:30.979Z,https://www.themoviedb.org/review/5e091e34a1c59d0018ab0aea
5e09b6c91684f700159c39d1,ThomasMoore,"{'name': '', 'username': 'ThomasMoore', 'avatar_path': '/39b4G3bZAotuY6uTMoI3JKdcO3c.jpg', 'rating': None}","If you're a fan of action, suspense, and awe worthy moments, then this movie is the right fit for you! Overall outstanding performance by everyone both on and off screen.",2019-12-30T08:35:21.957Z,en,99861,Avengers: Age of Ultron,movie,2021-06-23T15:58:31.081Z,https://www.themoviedb.org/review/5e09b6c91684f700159c39d1
5e0e0c5468b1ea00187f406e,JeffreyYoung,"{'name': '', 'username': 'JeffreyYoung', 'avatar_path': None, 'rating': None}","Despite the challenge of having to top their first Avengers film, Marvel did beautifully and the result was amazing. I hope to see more films like this in the future.",2020-01-02T15:29:24.122Z,en,99861,Avengers: Age of Ultron,movie,2021-06-23T15:58:31.260Z,https://www.themoviedb.org/review/5e0e0c5468b1ea00187f406e
5a844e0fc3a36862e100c22f,Gimly,"{'name': 'Gimly', 'username': 'Ruuz', 'avatar_path': '/xUObnJSvHrFPsIpoDmb1jiQZLq7.jpg', 'rating': 7.0}","The reviews for _Black Panther_ are all essentially saying the same thing: This is a great movie because it's so different from anything we've seen before, not just in the MCU but in the superhero genre overall, the villain is fantastic and _Black Panther_ is just a new and totally innovative film. Allow me to disagree (almost) entirely. _Black Panther_ is a great film, not because it breaks the mould, but because Marvel Studios has a successful pattern and _Black Panther_ adheres to it completely. Obviously the importance of a lead who is not just black but actually African is not to be understated, we have the least white cast of any superhero movie to date and they absolutely killed it, all very important socio-political stuff, to be sure. But the bones of _Black Panther_, the plot, the script, the events, the turns, all of that, it's a carbon copy of what's worked 17 times before. It works again, don't get me wrong, _Black Panther_ truly was an experience, both important and fantastic, but to say it re-invented the wheel here, is, to me, an outright lie.

_Final rating:★★★½ - I really liked it. Would strongly recommend you give it your time._",2018-02-14T14:56:15.274Z,en,284054,Black Panther,movie,2021-06-23T15:58:05.262Z,https://www.themoviedb.org/review/5a844e0fc3a36862e100c22f
5a87b8550e0a26535a047632,hankster3000,"{'name': '', 'username': 'hankster3000', 'avatar_path': None, 'rating': 1.0}",Overrated and overhyped. Definitely avoid. Watch on redbox if you must.,2018-02-17T05:06:29.941Z,en,284054,Black Panther,movie,2021-06-23T15:58:05.499Z,https://www.themoviedb.org/review/5a87b8550e0a26535a047632
5a8894ba0e0a2653db05d34f,Movie Queen41,"{'name': '', 'username': 'Movie Queen41', 'avatar_path': None, 'rating': 10.0}","This is definitely one of Marvel's best because the story is compelling and the characters are well developed. Black Panther and his friends and family must defend themselves and their homeland of Wakanda from the clutches of Klau (Andy Serkis) and Killmonger (Michael B. Jordan). Not only is the lead actor great as T'Challa/Black Panther, but the supporting cast does a fine job as well, especially the female actors. T'Challa is surrounded by smart, strong women. Marvel seems to break its villain curse with Klau and especially Killmonger. Killmonger is very well developed and even sympathetic at times, despite his villainy. He sort of reminded me of Tom Hiddleston's Loki. The action scenes and special effects are outstanding. Highly recommended if you enjoy comic book movies.",2018-02-17T20:46:50.715Z,en,284054,Black Panther,movie,2021-06-23T15:58:05.512Z,https://www.themoviedb.org/review/5a8894ba0e0a2653db05d34f
5a8dfdcf0e0a263e6e006d75,Crenor,"{'name': '', 'username': 'Crenor', 'avatar_path': None, 'rating': None}","Really good movie. Good story, lots of fun. This is what DC is missing.",2018-02-21T23:16:31.669Z,en,284054,Black Panther,movie,2021-06-23T15:58:05.885Z,https://www.themoviedb.org/review/5a8dfdcf0e0a263e6e006d75
5a93b14b0e0a2616c602de5e,Per Gunnar Jonsson,"{'name': 'Per Gunnar Jonsson', 'username': 'Dark Jedi', 'avatar_path': None, 'rating': 7.0}","It was with some hesitation that I went to see this movie. I was afraid that it would be burdened with too much political and social preaching. Especially knowing how much the movie is praised amongst certain factions in our society today. Sure enough there were indeed some of that nonsense but luckily it was much less than I feared.

I actually found the movie fairly entertaining. It is far from great, certainly very far from the insane hype surrounding it, but pretty okay. It is more or less a standard issue super hero movie on a big budget. Of course this means a fairly mediocre underlying story beefed up with lots of action and special effects.

The story itself is a traditional revenge story with some black power stuff. Nothing to write home about but it works as a vehicle for the action and special effects which is what makes this movie. There are the usual nonsense and plot holes in it of course. Like Shuri claiming that Vibranium (silly name but never mind) is instable at high speeds yet they have no problem making flying ships and other fast moving stuff with it.

The characters are a wee bit disappointing as far as the main characters are concerned. I felt that the main protagonist has little in terms of charisma. Killmonger, the main bad guy, was downright disappointing. To me he looked like the stereotype of a dumb thug and mostly he behaved like one. Bloody hell could they not have found an actor that looked less…well…stupid!

Personally the character I liked best was actually Klaue which was pretty cool, insane but cool. The female warriors, which were both kick-ass and smart, and Shuri is also fairly high up on my approval list.

Special effects! This is of course where this movie shines. Overall I think the special effects were good. The design of the various gadgets, ships etc were very nice. The rampaging rhinos in the final fight really made me laugh. I should have seen that coming. I definitely liked all the sonic effects. Obviously this movie would have been more or less null if the special effects would not have been a success.

On the whole Black Panther is a quite enjoyable special effects and action movie. Nothing more, nothing less. Some social preaching nonsense but less than I feared, hum ho story, lots of action and lots of special effects.",2018-02-26T07:03:39.064Z,en,284054,Black Panther,movie,2024-05-16T15:21:16.417Z,https://www.themoviedb.org/review/5a93b14b0e0a2616c602de5e
5ad008f6c3a36842e4004d4d,OblateSphereDroid,"{'name': '', 'username': 'OblateSphereDroid', 'avatar_path': None, 'rating': 9.0}","I was really surprised how much I liked this movie.  There was so much going on; immigration concerns; the fight between saving the world and protecting your own country(sound familiar); the fear of an African country’s resources being pillaged; how best to handle the problems black people face worldwide; and many great authentic feeling cultural nods.  All this while not being heavy or preachy.  You can definitely eat popcorn to this.  The villain; Killmonger, is great.  Not great in that he is scary, though he is, but because he is more complex than some shadowy figure you should just trust is a bad guy because of visual effects or dramatic music.  

This movie isn’t just explosions and one-liners in an exotic location.  This is a great movie in general.  It’s always interesting.  There are great relationships between all the characters.  Finally; Wakanda is really a place.  It feels alive and lived in; not just impressive buildings used as a backdrop.  They did a wonderful job of worldbuilding; from the rituals, to the clothing, fancy tech, and scenery.  This movie is definitely worth a watch. 

☆☆☆☆-1/2

I also have to add that; you get to actually see Andy Serkis!  When I saw his name I thought we was going to be some kind of CGI monster.  I’m just happy to see him get actual screen time.",2018-04-13T01:33:42.336Z,en,284054,Black Panther,movie,2021-06-23T15:58:07.653Z,https://www.themoviedb.org/review/5ad008f6c3a36842e4004d4d
5af0b71092514119a6000099,Dsnake1,"{'name': '', 'username': 'Dsnake1', 'avatar_path': None, 'rating': 7.0}","The Black Panther is a fun romp, but it definitely has some issues. First, the good.

The action is fun, the emotions hit home, and the story isn't dirt-poor. 

While the CGI gets ripped on from time to time, I thought it was solid enough for a Marvel movie. The fight scenes were relatively well-choreographed, as well. The ritual combat scenes were exciting and visually appealing. The fights in Korea were also fun to see, and while I'm not a fan of car chase scenes as a whole, I did enjoy this one. It was reminiscent of a James Bond movie. 

In fact, that's another appeal, at least to me. The secret technology base and the fun action scenes were a great callback to James Bond-type movies. I do think the movie would have been complemented by giving T'Challa a similar vice as Bond's, although Marvel probably wouldn't veer down that line for the seemingly morally absolute King of Wakanda.

The story, well, it's a mixed bag. Everything seemed crammed together with major emotional keys being rushed through or somewhat ignored. The concept is fine though. A long lost relative comes to challenge the new king, wins, and shows his colors, becoming something amoral. The king comes back and takes down the usurper, realizing something about themselves/their kingdom in the process. It's tired, but not so tired it damages the movie. 

This is where the issues begin to rise, though. The movie is really a movie and a half or two movies crammed into one. Wakanda has a ton of wonderful mythology, but almost none of it is explained. The movie never really explains how the Wakandans used vibranium was used to make themselves wealthy. It touches on it in some exposition, but there was much more that was just glossed over. 

In addition, W'Kabi became radicalized by Killmonger much too quickly for such a pivotal relationship to flip. Some of the emotional aspects of the movie fell flat because they weren't given enough screen time. 

Despite its flaws, Black Panther is a fun movie that adds to the Marvel Cinematic Universe. It should have been two movies, but I doubt this is the last we'll see of Wakanda.",2018-05-07T20:29:04.388Z,en,284054,Black Panther,movie,2021-06-23T15:58:08.418Z,https://www.themoviedb.org/review/5af0b71092514119a6000099
5b0e0e66c3a368714d000179,DanDare,"{'name': '', 'username': 'DanDare', 'avatar_path': '/gY0Mjm4thleETxdESQPabdn5CB3.jpg', 'rating': 6.0}","The character of T'Challa made his debut in Captain America 3: Civil War.

In Black Panther, T'Challa returns to his homeland of Wakanda after the death of his father who has been hiding a secret about his brother who lived in the USA. He now inherits the throne after a challenge from a rival.

Wakanda is an african country with wealth, power and immense technology that it hides from the outside world.

T'Challa's uncle wanted an uprising in the USA. Now his son Killmonger comes to Wakanda and challenges T'Challa for the throne.

Killmonger wins and leads the struggle for black power.

Black Panther is a well made efficient film from Marvel who really have nailed down their formula. The box office avalanche has surprised me. It simply is not that good with a very predictable story.",2018-05-30T02:37:26.128Z,en,284054,Black Panther,movie,2021-06-23T15:58:09.022Z,https://www.themoviedb.org/review/5b0e0e66c3a368714d000179
